慈雲宮,觀音佛祖,臺中市清水區菁埔里中山路564之5號,,,24.3000439,120.595568
三慶禪寺,釋迦牟尼佛,臺中市清水區吳厝里東山路37號,,,24.269292,120.598096
顯明寺,釋迦牟尼佛,臺中市清水區臨海路20之1號,,,24.2764452,120.5341307
保羅禪寺,釋迦牟尼佛,臺中市清水區吳厝里東山路135號,,,24.268875,120.600566
六祖禪寺,觀音佛祖,臺中市清水區吳厝里東山路新興巷192號,,,24.26996,120.605216
鎮元宮,開台聖王,臺中市清水區臨江里鎮平路14號,,,24.291162,120.556777
下湳里鎮安宮,五府千歲,臺中市清水區下湳里中山路529號,,,24.284065,120.583062
游三宮,游府千歲,臺中市清水區?榔里鰲峰路617之1號,,,24.301983,120.5854674
壽德宮,趙府元帥,臺中市清水區南社里南社路164號,,,24.266061,120.563356
八仙宮,孚佑帝君,臺中市清水區海濱里海濱路373號,,,24.286797,120.5462834
龍天宮,金府千歲,臺中市清水區西社里鎮新路21號,,,24.2719019,120.571715
護安宮,城隍尊神,臺中市清水區國姓里3美路50號,,,24.2968911,120.5782741
保安宮,蘇府千歲,臺中市清水區鰲峰里光明路51號,,,24.272932,120.57931
寶天宮,天上聖母,臺中市清水區秀水里海濱路190之16號,,,24.278581,120.561666
大明宮,五府千歲,臺中市清水區東山里神清路7號,,,24.273138,120.633944
開化宮,開台聖王,臺中市清水區武鹿里海濱路232之23號,,,24.280081,120.556483
進興廟,趙府千歲,臺中市清水區高西里高美路720之38號,,,24.311414,120.55428
青雲嶺太子殿,太子元帥,臺中市清水區吳厝里東山路38之1號,,,24.268865,120.586884
三官玉府尊宮,三官大帝,臺中市清水區臨江里高美路436之1號,,,24.294828,120.567517
玉和宮,玉皇上帝,臺中市清水區下湳里中山路525之10號,,,24.283322,120.581897
高美奉安宮,蘇府千歲,臺中市清水區高美里高美路603巷12號,,,24.309144,120.562865
中興宮,天上聖母,臺中市清水區高美里護岸路38號,,,24.3117501,120.5627879
慈法巖,清水祖師,臺中市清水區高西里高美路721巷31之4號,,,24.307703,120.553615
頂舊庄土地廟,福德正神,臺中市清水區海風里舊庄路19號,,,24.291348,120.629107
諸山宮,五府千歲,臺中市清水區高北里護岸路130巷29號,,,24.319596,120.570055
三太宮,三府王爺,臺中市清水區高東里溪頭路80-2號,,,24.308862,120.575511
佛元宮,濟公禪師,臺中市清水區高北里護岸路130巷23號,,,24.320056,120.569592
順天宮,媽祖,臺中市清水區橋頭里中華路587巷巷臨7之1號,,,24.275532,120.57188
良聖宮,媽祖,臺中市清水區武鹿里中央路55-9號,,,24.27576,120.548884
南宮,福德正神,臺中市清水區南寧里21鄰光華路137巷臨9-1號,,,24.2679162,120.5732385
九嚴殿,玄天上帝,臺中市清水區秀水里中央路97-7號,,,24.285078,120.56235
舊庄聖王宮,開台聖王,臺中市清水區海風里舊庄路19號,,,24.291348,120.629107
下湳里福德祠,福德正神,臺中市清水區下湳里中山路520之3號,,,24.292083,120.588509
清水壽山殿天公廟,玉皇大帝,臺中市清水區裕嘉里中央路107號,,,24.2888699,120.564003
南清宮,清府王爺,臺中市清水區海風里頂3庄路95號,,,24.2983958,120.6257423
正尚佛堂,明明上帝,臺中市清水區下南里中山路498之7號,,,24.287318,120.585573
清水竹巷媽廟,竹巷媽,臺中市清水區南寧里海濱路32號,,,24.270987,120.572344
三元宮,太子元帥,臺中市清水區楊厝里3庄路55號,,,24.304299,120.606512
永光寺,釋迦牟尼佛,臺中市大甲區水源路320號,,,24.342234,120.628331
金華寺,釋迦牟尼佛,臺中市大甲區岷山里金華路32號,,,24.3495008,120.6312149
妙法寺,釋迦牟尼佛,臺中市大甲區頂店里成功路63巷7號,,,24.3605753,120.6414941
大甲紫竹寺,觀世音菩薩,臺中市大甲區中山路一段1158巷46號,,,24.3573774,120.6377928
大甲鎮瀾宮,天上聖母,臺中市大甲區順天路158號,,,24.3452254,120.6234672
大甲城隍廟,威靈公都城隍,臺中市大甲區朝陽里新政路36號,,,24.3484839,120.6257499
陞德宮,韓府王爺,臺中市大甲區岷山里金華路12號,,,24.347793,120.630139
福山宮,福德正神,臺中市大甲區水源路351號,,,24.3412712,120.627595
鎮安宮,開台聖王,臺中市大甲區文曲里東安路497巷17號,,,24.333417,120.59735
德元宮,三府王爺,臺中市大甲區德化里賢仁路154號,,,24.362867,120.623525
建興宮,三府千歲,臺中市大甲區建興里如意路21巷1號,,,24.413591,120.615285
文昌宮,文昌公,臺中市大甲區孔門里文武路116號,,,24.3477593,120.6228014
路嬌姑廟,路嬌姑媽,臺中市大甲區孔門里文武路123巷2號,,,24.347333,120.621974
香雲精舍,阿彌陀佛觀世音菩薩大勢至菩薩,臺中市大甲區中山路二段159巷11-7、11-8號,,,24.379234,120.65141
鐵砧山國姓廟,鄭成功,臺中市大甲區頂店里成功路305號,,,24.36017,120.648375
幼獅工業區福德祠,福德正神,臺中市大甲區日南里12鄰青一路1巷2號,,,24.4045373,120.6422192
日南庄福德祠,福德正神,臺中市大甲區日南里4鄰日南路85號,,,24.392393,120.651751
孟春黃苗祠,黃苗神,臺中市大甲區孟春里臨江路54巷1號,,,24.380945,120.652361
日南慈德宮,天上聖母,臺中市大甲區孟春里通天路152號,,,24.3702699,120.6712342
教化講堂,明明上帝,臺中市大甲區幸福里7鄰東明路83號,,,24.373778,120.680758
武聖宮,關聖帝君,臺中市大甲區武曲里橫圳街315號,,,24.3585775,120.6106535
福興宮,五榖大帝,臺中市外埔區三崁村三崁路57號,,,24.3199957,120.65024
福龍宮,關聖帝君,臺中市外埔區馬鳴村上城路450號,,,24.332041,120.654385
慈蓮寺,觀世音菩薩,臺中市外埔區鐵山村長生路429號,,,24.3470558,120.6529488
福慧禪寺,本師釋迦牟尼佛,臺中市外埔區三崁村三崁路78號,,,24.3199957,120.65024
天君宮,天上聖母,臺中市外埔區大同村甲后路446號,,,24.3321986,120.6528849
彌勒禪寺,彌勒尊佛,臺中市外埔區水美村溪底路30號,,,24.3233758,120.6177756
南海普渡寺,觀世音菩薩,臺中市外埔區永豐村6分路86號,,,24.342621,120.6360294
無極三清總道院,三清道祖,臺中市外埔區水美村山腳巷77號,,,24.3302179,120.6269445
外埔法華寺,本師釋迦牟尼佛,臺中市外埔區永豐村6分路5號,,,24.3165141,120.6871871
馬鳴福德祠,福德正神,臺中市外埔區馬鳴村新厝路78號之3號,,,24.3371789,120.681286
忘憂谷觀音寺,觀世音菩薩,臺中市外埔區三崁村溪底路26號,,,24.312811,120.6493883
土城大眾爺廟,大眾爺,臺中市外埔區土城西路197號,,,24.3462456,120.7058382
慶安宮,五谷仙帝,臺中市大安區海漧村10鄰中山北路1巷71號,,,25.057359,121.523063
廣元宮,保安尊王,臺中市大安區龜殼村9鄰溪洲路196號,,,24.3646284,120.5869034
保安宮,保安尊王,臺中市大安區松雅村6鄰松1街3號,,,24.3633474,120.604168
南坤身廟,朱府千歲,臺中市大安區南庄村7鄰南海路50號,,,24.3500137,120.5751185
泰安宮,九天玄女,臺中市大安區西安村6鄰南北8路56號,,,24.3705944,120.5945711
崇善祠,泉州公,臺中市大安區海漧村3鄰中山北路110巷2號,,,25.085778,121.526097
大眾爺祠,大眾媽神,臺中市大安區海漧村9鄰大安港路1210號,,,24.3702355,120.5912217
安田鎮安宮,蘇府王爺,臺中市大安區頂安村7鄰東西路70巷36號,,,24.3376902,120.6639979
鎮南宮,朱薛彭三府王爺,臺中市大安區南埔村8鄰南庄路52號,,,24.3399416,120.5710804
永安宮,秦蘇李三府王爺,臺中市大安區東安村4鄰福東路95號,,,24.3358437,120.5911065
環海宮,六府千歲,臺中市大安區永安村5鄰東西三路263之1號,,,24.3857938,120.6010716
延平宮,延平郡王,臺中市大安區龜殼村4鄰溪洲路70號,,,24.3621403,120.5947843
聖仙宮,李府仙祖,臺中市大安區龜殼村6鄰埔頭路77號,,,24.3572831,120.5903573
和安宮,金吉姚三府王爺,臺中市大安區海漧村大安港路1205號,,,24.3702355,120.5912217
保安宮,金李池三府王爺,臺中市大安區福住村北汕路10巷1號,,,24.3842478,120.5892345
南安宮,天上聖母,臺中市大安區南庄村237巷19號,,,24.3506396,120.5710804
鎮安宮,天上聖母,臺中市大安區福興村6鄰 中松路233號,,,24.3553068,120.5991244
永安宮,太子元帥,臺中市大安區永安村5鄰東西三路240號,,,24.3860056,120.6020995
王聖金母宮,無極王母娘娘,臺中市大安區西安村南北8路22號,,,24.3679639,120.6066336
福安宮,朱李池王爺,臺中市大安區福住村南北七路162巷7號,,,24.3799295,120.6034649
甲安宮,蕭府王爺,臺中市大安區永安村5甲莊南路56-1號,,,24.3847374,120.604168
